{
	"schemaVersion": "harness-execution-job/v1",
	"ticket": "00000000-0000-4000-8000-000000000000",
	"requestKey": "example-node-version",
	"fingerprint": "example-fingerprint",
	"command": ["node", "--version"],
	"cwd": ".",
	"artifactsDir": "artifacts/agent-runs",
	"resourceLanes": ["repo-read"],
	"parallelSafe": true,
	"conflictsWith": [],
	"timeoutSeconds": 300,
	"attempt": 1,
	"retryDecision": "safe",
	"status": "pass",
	"createdAt": "2026-07-14T00:00:00.000Z",
	"startedAt": "2026-07-14T00:00:00.010Z",
	"completedAt": "2026-07-14T00:00:00.022Z",
	"queueWaitMs": 10,
	"durationMs": 12,
	"cancelRequested": false,
	"pid": null,
	"workerPid": null,
	"processToken": null,
	"resultPath": "00000000-0000-4000-8000-000000000000/execution-result.json",
	"failureClass": null,
	"nextAction": "No local retry required.",
	"claimsBoundary": {
		"localExecution": "proven",
		"hostedCi": "not_checked",
		"reviewState": "not_checked",
		"mergeReadiness": "not_checked"
	}
}
